{
  "schema_version": 1,
  "id": "persistent_array_repeated_update",
  "description": "A persistent array supports ordinary repeated reads and indexed writes across calls.",
  "source": "programs/persistent_array_repeated_update.m",
  "tags": ["r2022b", "global-persistent", "persistent", "arrays", "indexing", "state"],
  "expected": {
    "outcome": "ok",
    "value": {
      "class": "double",
      "size": [1, 12],
      "ndims": 2,
      "numel": 12,
      "kind": "numeric",
      "real": ["2", "4", "6", "2", "7", "6", "2", "7", "6", "2", "5", "6"],
      "imag": ["0", "0", "0", "0", "0", "0", "0", "0", "0", "0", "0", "0"]
    }
  }
}
