{
  "schema_version": 1,
  "id": "empty_concatenation_shape",
  "description": "Vertical concatenation with a zero-by-two operand preserves the nonempty row.",
  "source": "programs/empty_concatenation_shape.m",
  "tags": ["r2022b", "arrays", "empty", "concatenation", "shape"],
  "expected": {
    "outcome": "ok",
    "value": {
      "class": "double",
      "size": [1, 2],
      "ndims": 2,
      "numel": 2,
      "kind": "numeric",
      "real": ["5", "6"],
      "imag": ["0", "0"]
    }
  }
}
