{
  "schema_version": 1,
  "id": "empty_zero_by_three",
  "description": "An empty array retains a zero-by-three shape.",
  "source": "programs/empty_zero_by_three.m",
  "tags": ["r2022b", "arrays", "empty", "shape"],
  "expected": {
    "outcome": "ok",
    "value": {
      "class": "double",
      "size": [0, 3],
      "ndims": 2,
      "numel": 0,
      "kind": "numeric",
      "real": [],
      "imag": []
    }
  }
}
