{
  "schema_version": 1,
  "id": "logical_short_circuit",
  "description": "Scalar short-circuit operators skip an undefined right operand when possible.",
  "source": "programs/logical_short_circuit.m",
  "tags": ["r2022b", "logical", "operators", "short-circuit"],
  "expected": {
    "outcome": "ok",
    "value": {
      "class": "logical",
      "size": [1, 4],
      "ndims": 2,
      "numel": 4,
      "kind": "logical",
      "logical": [false, true, true, true]
    }
  }
}
